guard_row_id,state_version,claim_target,activation_allowed_now,current_blocker,required_next_evidence,hard_fail_if_activated_early,claim_boundary
MAINLINE-STATE-GUARD-comsol_launch,sidewall_mainline_execution_state_update_v1,comsol_launch,False,target binding and command hash absent,WO-002 target binding receipt,comsol_launch_true_without_target_binding,mainline_state_update_candidate_evidence_not_route_yield_detection
MAINLINE-STATE-GUARD-route_score_winner_JRC,sidewall_mainline_execution_state_update_v1,route_score_winner_JRC,False,detector/blank and wet accepted evidence absent,WO-004 and WO-005 accepted evidence rows,route_score_true_without_detector_and_wet_evidence,mainline_state_update_candidate_evidence_not_route_yield_detection
MAINLINE-STATE-GUARD-yield,sidewall_mainline_execution_state_update_v1,yield,False,wet accepted evidence absent,WO-005 accepted wet observation rows,yield_true_without_accepted_wet_evidence,mainline_state_update_candidate_evidence_not_route_yield_detection
MAINLINE-STATE-GUARD-detection_probability,sidewall_mainline_execution_state_update_v1,detection_probability,False,detector/blank accepted evidence absent,WO-004 accepted detector/blank transfer rows,detection_probability_true_without_accepted_detector_evidence,mainline_state_update_candidate_evidence_not_route_yield_detection
MAINLINE-STATE-GUARD-production_ingestion,sidewall_mainline_execution_state_update_v1,production_ingestion,False,integrated closeout absent,WO-008 integrated release closeout,production_ingestion_true_before_closeout,mainline_state_update_candidate_evidence_not_route_yield_detection
