guard_row_id,packet_version,promotion_target,implementation_authorized,fixture_or_contract_available,claim_promoted_current,claim_promotion_allowed_now,required_evidence_before_true,hard_fail_if_missing_evidence,claim_boundary
WET-OBS-GUARD-wet_pass_probability,sidewall_wet_observation_execution_packet_v1,wet_pass_probability,True,True,False,False,"accepted sidewall wet observations with controls, replicates, and uncertainty",wet_pass_probability_true_without_accepted_wet_observations,wet_observation_execution_packet_not_yield_not_wet_pass_not_detection
WET-OBS-GUARD-clogging_rate_time_to_clog_recovery,sidewall_wet_observation_execution_packet_v1,clogging_rate_time_to_clog_recovery,True,True,False,False,time-resolved wet observations or validated transfer model with denominators,clogging_or_recovery_true_without_time_resolved_wet_evidence,wet_observation_execution_packet_not_yield_not_wet_pass_not_detection
WET-OBS-GUARD-yield,sidewall_wet_observation_execution_packet_v1,yield,True,True,False,False,accepted wet evidence plus detector/blank and route policy packets,yield_true_without_wet_and_detector_blank_evidence,wet_observation_execution_packet_not_yield_not_wet_pass_not_detection
WET-OBS-GUARD-detection_probability,sidewall_wet_observation_execution_packet_v1,detection_probability,True,True,False,False,wet evidence may inform detection only after detector/blank packet passes,detection_probability_true_from_wet_observation_only,wet_observation_execution_packet_not_yield_not_wet_pass_not_detection
WET-OBS-GUARD-route_score_winner_JRC,sidewall_wet_observation_execution_packet_v1,route_score_winner_JRC,True,True,False,False,"wet, detector/blank, flow/q_ch, and route formula packets",route_score_true_without_wet_observation_packet,wet_observation_execution_packet_not_yield_not_wet_pass_not_detection
