state_row_id,state_version,work_order_id,lane,previous_blocker,current_state,current_evidence_artifact_id,current_evidence_disposition,current_evidence_rows,claim_activation_allowed_now,next_required_action,hard_fail_if,claim_boundary
MAINLINE-STATE-WO-001-current-head-source-lock,sidewall_mainline_execution_state_update_v1,WO-001-current-head-source-lock,source_lock_and_commit_binding,downstream evidence packets must be regenerated from current reviewed head before claim activation,current_source_lock_receipt_available,PACKAGE_C_SIDEWALL_MAINLINE_EXECUTION_WORK_ORDER_20260701,NODI_PACKAGE_C_SIDEWALL_MAINLINE_EXECUTION_WORK_ORDER_READY_LARGE_BLOCKS_PRIORITIZED,8,False,keep regenerating downstream evidence from the latest committed head,source_lock_missing_or_route_geometry_scope_lost,mainline_state_update_candidate_evidence_not_route_yield_detection
MAINLINE-STATE-WO-002-comsol-target-binding,sidewall_mainline_execution_state_update_v1,WO-002-comsol-target-binding,comsol_target_model_and_command_binding,target model/script and launch command hash are not bound,open_target_binding_required,PACKAGE_C_SIDEWALL_COMSOL_LAUNCH_PRECONDITION_20260701,NODI_PACKAGE_C_SIDEWALL_COMSOL_LAUNCH_PRECONDITION_READY_TARGET_BINDING_REQUIRED,5,False,bind target .mph/script and launch command hash before any COMSOL run,comsol_launch_true_without_target_binding,mainline_state_update_candidate_evidence_not_route_yield_detection
MAINLINE-STATE-WO-003-electrokinetic-profile-grid,sidewall_mainline_execution_state_update_v1,WO-003-electrokinetic-profile-grid,electrokinetic_profile_aware_grid,profile-aware grid implementation and rectangle/theta mutation tests are absent,candidate_profile_grid_available_not_solver,PACKAGE_C_SIDEWALL_ELECTROKINETIC_PROFILE_GRID_CANDIDATE_20260701,NODI_PACKAGE_C_SIDEWALL_ELECTROKINETIC_PROFILE_GRID_CANDIDATE_READY_NOT_SOLVER,5,False,calibrate or solve electrokinetic model before using weights in route formulas,electrokinetic_weight_true_from_candidate_grid_only,mainline_state_update_candidate_evidence_not_route_yield_detection
MAINLINE-STATE-WO-004-detector-blank-transfer,sidewall_mainline_execution_state_update_v1,WO-004-detector-blank-transfer,detector_blank_transfer_evidence,accepted sidewall-specific or validated-transfer detector/blank rows are absent,open_accepted_transfer_rows_required,PACKAGE_C_SIDEWALL_DETECTOR_BLANK_TRANSFER_EXECUTION_PACKET_20260701,NODI_PACKAGE_C_SIDEWALL_DETECTOR_BLANK_TRANSFER_EXECUTION_PACKET_READY_EVIDENCE_REQUIRED,0,False,ingest accepted detector/blank transfer rows for both route families,detection_probability_true_without_accepted_transfer_rows,mainline_state_update_candidate_evidence_not_route_yield_detection
MAINLINE-STATE-WO-005-wet-observation,sidewall_mainline_execution_state_update_v1,WO-005-wet-observation,wet_observation_evidence,accepted wet observation rows with controls and uncertainty are absent,open_accepted_wet_rows_required,PACKAGE_C_SIDEWALL_WET_OBSERVATION_EXECUTION_PACKET_20260701,NODI_PACKAGE_C_SIDEWALL_WET_OBSERVATION_EXECUTION_PACKET_READY_OBSERVATIONS_REQUIRED,0,False,ingest accepted wet observation rows with controls and uncertainty,yield_or_wet_claim_true_without_accepted_wet_rows,mainline_state_update_candidate_evidence_not_route_yield_detection
MAINLINE-STATE-WO-006-route-yield-detection-formula-binding,sidewall_mainline_execution_state_update_v1,WO-006-route-yield-detection-formula-binding,route_yield_detection_formula_binding,detector/blank and wet accepted evidence are both required before formula binding,open_formula_binding_waiting_for_detector_and_wet,PACKAGE_C_SIDEWALL_ROUTE_DECISION_EXECUTION_READINESS_20260701,NODI_PACKAGE_C_SIDEWALL_ROUTE_DECISION_EXECUTION_READINESS_READY_BRANCH_STATUSES_NOT_CLAIMS,2,False,prepare formula schema but activate only after detector and wet rows pass,route_score_yield_detection_true_before_detector_and_wet,mainline_state_update_candidate_evidence_not_route_yield_detection
MAINLINE-STATE-WO-007-runtime-substep-policy,sidewall_mainline_execution_state_update_v1,WO-007-runtime-substep-policy,reflection_runtime_substep_policy,runtime substep/fail policy is not yet bound to large-step and near-closed guards,guarded_runtime_smoke_available_stress_blocked,PACKAGE_C_RUNTIME_SUBSTEP_EXECUTION_PACKET_20260701,NODI_PACKAGE_C_RUNTIME_SUBSTEP_EXECUTION_PACKET_READY_WITH_GUARDED_SMOKE,1,False,keep stress/prohibitive runtime blocked or substeped before PRS/EAS pilot,sidewall_runtime_enabled_without_guarded_substep_policy,mainline_state_update_candidate_evidence_not_route_yield_detection
MAINLINE-STATE-WO-008-mainline-integration-closeout,sidewall_mainline_execution_state_update_v1,WO-008-mainline-integration-closeout,mainline_integration_and_release_closeout,branch evidence is distributed across packets and needs a single promotion ledger after inputs pass,open_until_external_input_lanes_close,PACKAGE_C_TRAPEZOID_FLOW_SOLVER_CANDIDATE_20260701,NODI_PACKAGE_C_TRAPEZOID_FLOW_SOLVER_CANDIDATE_READY_NOT_QCH,2,False,refresh integrated promotion ledger after COMSOL/detector/wet lanes close,production_ingestion_true_before_integrated_closeout,mainline_state_update_candidate_evidence_not_route_yield_detection
