firewall_id,target,current_value,formal_qch_sidecar_available,hard_fail_if,required_before_true,claim_boundary
FORMAL-QCH-FIREWALL-01,q_ch_weighting,false,true,q_ch_weighting_true_from_formal_qch_receipt_alone,explicit q_ch weighting policy and route scoring authorization consuming formal sidecar,formal_qch_receipt_bridge_not_qch_weighting_not_route_score_not_yield_not_detection
FORMAL-QCH-FIREWALL-02,route_score,false,true,route_score_true_from_formal_qch_receipt_alone,"detector/blank validation, wet endpoint bundle, and route scoring formula review",formal_qch_receipt_bridge_not_qch_weighting_not_route_score_not_yield_not_detection
FORMAL-QCH-FIREWALL-03,winner,false,true,winner_true_from_formal_qch_receipt_alone,"route_score audit, no-borrowing guards, and explicit winner policy",formal_qch_receipt_bridge_not_qch_weighting_not_route_score_not_yield_not_detection
FORMAL-QCH-FIREWALL-04,yield,false,true,yield_true_from_formal_qch_receipt_alone,accepted wet/surface endpoint bundle with uncertainty and controls,formal_qch_receipt_bridge_not_qch_weighting_not_route_score_not_yield_not_detection
FORMAL-QCH-FIREWALL-05,detection_probability,false,true,detection_probability_true_from_formal_qch_receipt_alone,sidewall detector response validation plus sidewall blank false-positive trace,formal_qch_receipt_bridge_not_qch_weighting_not_route_score_not_yield_not_detection
FORMAL-QCH-FIREWALL-06,production_ingestion,false,true,production_ingestion_true_from_formal_qch_receipt_alone,full route/yield/detection release packet and production acceptance,formal_qch_receipt_bridge_not_qch_weighting_not_route_score_not_yield_not_detection
