blocker_id,ledger_version,evidence_lane,current_status,required_before_promotion,blocks_target_claims,claim_boundary
formal_qch_sidecar_not_accepted,sidewall_integrated_promotion_preflight_ledger_v1,flow_split_qch,candidate_qch_sidecar_not_formal_weighting,formal q_ch sidecar authorization and pressure-flow validation at route grain,route_score;winner;detection_probability,promotion_preflight_not_route_score_not_winner_not_yield_not_detection_probability
pressure_flow_context_only_not_formal_validation,sidewall_integrated_promotion_preflight_ledger_v1,pressure_flow_validation,context_only_not_formal_validation,sidewall-matched COMSOL/measurement or accepted pressure-flow validation,route_score;winner;q_ch_weighting,promotion_preflight_not_route_score_not_winner_not_yield_not_detection_probability
selected_annulus_context_missing,sidewall_integrated_promotion_preflight_ledger_v1,selected_annulus_detection_context,selected_annulus_context_missing_rerun_required,rerun or validate selected-annulus detection context at the route grain,detection_probability;route_score;winner,promotion_preflight_not_route_score_not_winner_not_yield_not_detection_probability
true_reference_calibration_from_synthetic_seed,sidewall_integrated_promotion_preflight_ledger_v1,blank_channel_reference_amplitude_phase,synthetic_seed_available_not_experimental,measured blank-channel amplitude and phase table or EM solver output for W500/D900 theta grid,calibrated_or_full_wave_sidewall_optical_solver,promotion_preflight_not_route_score_not_winner_not_yield_not_detection_probability
geometry_generalization_from_single_seed,sidewall_integrated_promotion_preflight_ledger_v1,sidewall_geometry_coverage,single_W500_D900_theta85_and_rectangle_seed_only,coverage for required widths/depths/angles or explicit interpolation/extrapolation guard,true_W_eff,promotion_preflight_not_route_score_not_winner_not_yield_not_detection_probability
detector_response_claim_from_reference_amplitude_only,sidewall_integrated_promotion_preflight_ledger_v1,detector_response_bridge,not_detector_response_validation,"detector operator, ROI/slit throughput, and standard-particle calibration consuming sidewall reference field",detection_probability,promotion_preflight_not_route_score_not_winner_not_yield_not_detection_probability
false_positive_rate_from_synthetic_smoke,sidewall_integrated_promotion_preflight_ledger_v1,blank_false_positive_trace,blank_trace_validation_missing_for_sidewall_geometry,sidewall-specific blank traces or validated transferable blank false-positive model,detection_probability,promotion_preflight_not_route_score_not_winner_not_yield_not_detection_probability
yield_or_wet_pass_from_geometry_surrogate,sidewall_integrated_promotion_preflight_ledger_v1,wet_wall_interaction,wet_sidewall_evidence_missing,"sidewall material/surface/wet EV adhesion, clogging, recovery, and passability evidence",yield,promotion_preflight_not_route_score_not_winner_not_yield_not_detection_probability
route_winner_from_single_branch_smoke,sidewall_integrated_promotion_preflight_ledger_v1,integrated_route_ledger,route_score_not_authorized_from_seed,"ledger binding calibrated optical, flow split, wet evidence, and route-selection policy",route_score_or_winner,promotion_preflight_not_route_score_not_winner_not_yield_not_detection_probability
