guard_row_id,review_version,promotion_target,implementation_authorized,activation_allowed_now,required_evidence_before_activation,hard_fail_if_activated_early,claim_boundary
YIELD-DETECTION-CLAIM-VALUE-GUARD-detection_probability,sidewall_yield_detection_claim_value_review_v1,detection_probability,True,False,accepted simulation-derived detection probability value rows for every route,detection_probability_true_without_value_rows,yield_detection_claim_value_review_requires_simulation_value_rows
YIELD-DETECTION-CLAIM-VALUE-GUARD-yield,sidewall_yield_detection_claim_value_review_v1,yield,True,False,accepted simulation-derived yield value rows for every route,yield_true_without_value_rows,yield_detection_claim_value_review_requires_simulation_value_rows
YIELD-DETECTION-CLAIM-VALUE-GUARD-wet_pass_probability,sidewall_yield_detection_claim_value_review_v1,wet_pass_probability,True,False,accepted simulation-derived wet-pass value rows for every route,wet_pass_probability_true_without_value_rows,yield_detection_claim_value_review_requires_simulation_value_rows
YIELD-DETECTION-CLAIM-VALUE-GUARD-simulation_detection_probability_candidate,sidewall_yield_detection_claim_value_review_v1,simulation_detection_probability_candidate,True,False,accepted simulation-derived detection probability value rows for every route,simulation_detection_candidate_true_without_value_rows,yield_detection_claim_value_review_requires_simulation_value_rows
YIELD-DETECTION-CLAIM-VALUE-GUARD-simulation_yield_wet_candidate,sidewall_yield_detection_claim_value_review_v1,simulation_yield_wet_candidate,True,False,accepted simulation-derived yield and wet-pass value rows for every route,simulation_yield_wet_candidate_true_without_value_rows,yield_detection_claim_value_review_requires_simulation_value_rows
YIELD-DETECTION-CLAIM-VALUE-GUARD-production_ingestion,sidewall_yield_detection_claim_value_review_v1,production_ingestion,True,False,separate fabrication/production release after integrated review,production_ingestion_true_from_claim_value_review,yield_detection_claim_value_review_requires_simulation_value_rows
