blocker_id,excluded_scope,source_candidate_status,nodi_source_candidate_row_count,comsol_source_rows_covered,carry_forward_disposition,context_only_acceptance_allowed,decision_use_allowed,can_enter_weighting,can_enter_jrc,is_chi_selected,is_production_ingestion,is_runtime_configuration,required_next_gate
BLOCKER-001,220 nm,BLOCKED_220NM_NO_DIRECT_MATCH,72,72,blocked; no direct PRS match; no auto-map to 300/40/60,false,false,false,false,false,false,false,future explicit repair/export/policy gate
BLOCKER-002,W800/D1200 300 nm,BLOCKED_D1200_EXACT_GRAIN_UNCERTAIN,36,36,blocked/uncertain; cannot borrow D900 semantics,false,false,false,false,false,false,false,future explicit repair/export/policy gate
BLOCKER-003,TPD source/alignment,BLOCKED_UNBOUND_NODI_VIEW,16,16,blocked missing NODI_view / not NODI-bound,false,false,false,false,false,false,false,future explicit repair/export/policy gate
BLOCKER-004,edge4 bin proxy,REVIEW_ONLY_EDGE_POLICY_REQUIRED,16,16,review-only; edge4-to-edge20 policy not approved,false,false,false,false,false,false,false,future explicit repair/export/policy gate
BLOCKER-005,q_ch provenance,QUARANTINE_QCH_PROVENANCE_ONLY,1,1,quarantine; not formal q_ch sidecar; no weighting,false,false,false,false,false,false,false,future explicit repair/export/policy gate
BLOCKER-006,local-Q/V4/strong claims,not_in_reduced_scope,0,,review-only or hard blocked carry-forward,false,false,false,false,false,false,false,future explicit repair/export/policy gate
BLOCKER-007,local-Q diagnostics,REVIEW_ONLY_LOCAL_Q_DIAGNOSTICS,not_in_Gate2D_candidate_scope,not_in_Gate2D_candidate_scope,review-only or hard blocked; not part of accepted reduced scope,false,false,false,false,false,false,false,separate future review gate
BLOCKER-008,V4 claim ceiling,REVIEW_ONLY_V4_CLAIM_CEILING,not_in_Gate2D_candidate_scope,not_in_Gate2D_candidate_scope,review-only or hard blocked; not part of accepted reduced scope,false,false,false,false,false,false,false,separate future review gate
BLOCKER-009,strong claims,HARD_BLOCKED_STRONG_CLAIMS,not_in_Gate2D_candidate_scope,not_in_Gate2D_candidate_scope,review-only or hard blocked; not part of accepted reduced scope,false,false,false,false,false,false,false,separate future review gate
